{
  "parent_sku": "824100",
  "title": "Präsent Zeilenweise (Fixture-Join)",
  "active": true,
  "html": "<p>Nur zum Test: Sage liefert Kennzeichnung je BOM-Zeile, nicht als Parent-Block.</p>",
  "components": [
    {
      "sku": "610001",
      "qty": 1,
      "nutrition_html": "1.0 x Beispielwein zeilenweise Zutatenverzeichnis Trauben, Sulfite"
    },
    {
      "sku": "730001",
      "qty": 1,
      "nutrition_html": "1.0 x Beispielfood zeilenweise Nährwerte …"
    }
  ]
}
